Date,Agency,Category,Title,Link
15. June 2026,ANVISA,Announcement,ANVISA updates understanding on interchangeability of biosimilars,https://www.linkedin.com/feed/update/urn:li:activity:7471080599856820224/
15. June 2026,ANVISA,Announcement,ANVISA advances in the creation of the National Pharmacovigilance System,https://www.linkedin.com/feed/update/urn:li:activity:7471082735902629888/
15. June 2026,ANVISA,Guidance,ANVISA Manual of Instructions for Notification in the VigiMed System for Health Services,https://www.linkedin.com/feed/update/urn:li:activity:7470340547451392001/
15. June 2026,Egyptian Drug Authority,Post,Notice to Applicant for Public Dissemination of Clinical Trials Scientific and Regulatory Data,https://www.linkedin.com/feed/update/urn:li:activity:7470344727532593152/
15. June 2026,European Data Protection Board,Template,Template [2026] for Personal Data Breach Notification (Version 1.0),https://www.linkedin.com/feed/update/urn:li:activity:7470720853207506944/
15. June 2026,European Directorate for the Quality of Medicines & HealthCare (EDQM),Report,"European Directorate for the Quality of Medicines & HealthCare (EDQM), Council of Europe Certification Monthly Report End of May 2026",https://www.linkedin.com/feed/update/urn:li:activity:7470352112867192832/
15. June 2026,European Medicines Agency,Meeting,Pharmacovigilance Risk Assessment Committee (PRAC) 8-11 June 2026,https://www.linkedin.com/feed/update/urn:li:activity:7471224155577749505?
15. June 2026,European Medicines Agency,Plan,Heads of Medicines Agencies (HMA) Joint Big Data Steering Group: Change Management Activities Delivery Plan 2026,https://www.linkedin.com/feed/update/urn:li:activity:7471087543866961922/
15. June 2026,European Medicines Agency,Guidance,Product Management Services (PMS) Implementation of ISO IDMP in Europe: Chapter 3 Process for the Electronic Submission of Medicinal Product Information (Version 3.6),https://www.linkedin.com/feed/update/urn:li:activity:7471090238338154496/
15. June 2026,European Medicines Agency,Post,Meeting highlights from the Pharmacovigilance Risk Assessment Committee (PRAC) 8-11 June 2026,https://www.linkedin.com/feed/update/urn:li:activity:7471224155577749505/
15. June 2026,European Medicines Agency,Post,Annual Report 2025,https://www.linkedin.com/feed/update/urn:li:activity:7471224595262644224/
15. June 2026,European Medicines Agency,CECP Opinion,Expert Decision and Opinion in the Context of the Clinical Evaluation Consultation Procedure (CECP) Shoulder Prosthesis (NB 2797),https://www.linkedin.com/feed/update/urn:li:activity:7470718445161070592/
15. June 2026,European Medicines Agency,Post,Just published: 4th progress report on the use of real-world evidence (RWE) in medicines regulation,https://www.linkedin.com/feed/update/urn:li:activity:7470490393520988160/
15. June 2026,European Medicines Agency,Presentation,EnprEMA & ACT EU Workshop on Paediatric Clinical Trials (12 May 2026),https://www.linkedin.com/feed/update/urn:li:activity:7469986497656573952/
15. June 2026,European Medicines Agency,Guidance,Registration Guide for UI and API Users Union Product Database (UPD) for Veterinary Medicinal Products,https://www.linkedin.com/feed/update/urn:li:activity:7469632317083299840/
15. June 2026,European Union Agency for Cybersecurity (ENISA),Report,Getting ready for the EU Cyber Resilience Act - Building digital products that are secure by design and by default.,https://www.linkedin.com/feed/update/urn:li:activity:7470144135635763203/
15. June 2026,European Union Agency for Cybersecurity (ENISA),Report,SBOM Adoption State of Play 2026,https://www.linkedin.com/feed/update/urn:li:activity:7470338731531640832/
15. June 2026,Health Canada,Feedback,Sante Canada What We Heard: Draft Guidance on Decentralized Clinical Trials,https://www.linkedin.com/feed/update/urn:li:activity:7471085684796309504/
15. June 2026,Health Products Regulatory Authority (HPRA),Guidance,Application to Vary a Wholesale Distribution Authorisation (AUT-F0792-7),https://www.linkedin.com/feed/update/urn:li:activity:7469979765991591937/
15. June 2026,Medicines and Healthcare products Regulatory Agency,Report,AI Airlock Phase 2 Findings Published,https://www.linkedin.com/feed/update/urn:li:activity:7470355241906135041/
15. June 2026,Medicines and Healthcare products Regulatory Agency,Guidance,Clinical Trials for Medicines: Modifying a Clinical Trial Approval (MHRA) The guidance became fully effective following implementation of the amended UK Clinical Trials Regulations on 28 April 2026.,https://www.linkedin.com/feed/update/urn:li:activity:7469989021750923266/
15. June 2026,MedTech Europe,Response,Response to the EDPB Public Consultation on DPIA Template,https://www.linkedin.com/feed/update/urn:li:activity:7471077948553400320/
15. June 2026,MedTech Leading Voice,Article/Video,"Preview Regulatory Roundup Monday, 15 June 2026",https://www.linkedin.com/feed/update/urn:li:activity:7471123289264996353/
15. June 2026,NMPA-National Medical Products Administration,Guidance,Good Practice for Drug Clinical Trials (2026 Revision) Announcement no. 50/2026,https://www.linkedin.com/feed/update/urn:li:activity:7469996141728751616/9. June 2026
15. June 2026,NMPA-National Medical Products Administration,Standards,Announcement on the Abolition of 10 Medical Device Industry Standards (NMPA Announcement no. 56 of 2026),https://www.linkedin.com/feed/update/urn:li:activity:7469635539889963008/
15. June 2026,South African Health Products Regulatory Authority,Communication,Clinical Trial Applications Electronic System Update,https://www.linkedin.com/feed/update/urn:li:activity:7469629859611291649/
15. June 2026,Swissmedic,Guidance,Swissmedic swissdamed Machine-to-Machine REST API Documentation (BW630_40_810 v3.0),https://www.linkedin.com/feed/update/urn:li:activity:7469991122845655040/
15. June 2026,Swissmedic,Guidance,Swissmedic Anforderungen Ph.,https://www.linkedin.com/feed/update/urn:li:activity:7469992611257298945/
15. June 2026,Swissmedic,Guidance,"Swissmedic Anforderungen PhHelv KomplMedAM (RN106_00_004 v4.2) Version 4.2 updates the document footer only, with no substantive regulatory changes.",https://www.linkedin.com/feed/update/urn:li:activity:7469994397301067776/
15. June 2026,Team-NB,Template,Team-NB Agreement Related to the Transfer of IVDR Formal Application and of Appropriate Surveillance of Legacy Devices,https://www.linkedin.com/feed/update/urn:li:activity:7470716405982625792/
15. June 2026,Therapeutic Goods Administration,Guidance,Compliance Principles 2026 and 2027,https://www.linkedin.com/feed/update/urn:li:activity:7470346527299842049/
15. June 2026,USA Food & Drug Administration FDA,Consultation,FDA Extends Comment Period on Drug Repurposing Initiative,https://www.linkedin.com/feed/update/urn:li:activity:7470713548839653376/
15. June 2026,USA Food & Drug Administration FDA,Update,FDA Breakthrough Devices Program (FDA) updated programme metrics through 31 March 2026.,https://www.linkedin.com/feed/update/urn:li:activity:7469981780914126849/
15. June 2026,USA Food & Drug Administration FDA,Request for Information,FDA Biomarker Incubator: Urinary Kidney Safety Biomarkers; Request for Information (FDA2026N0005),https://www.linkedin.com/feed/update/urn:li:activity:7469984528753942528/
15. June 2026,World Health Organization,Guidance,Digital Transformation Handbook for Reporting Substandard and Falsified Medical Products,https://www.linkedin.com/feed/update/urn:li:activity:7470348603673391104/
