Date,Agency,Category,Title,Link
2. March 2026,Medicines and Healthcare products Regulatory Agency,Guidance,Clinical trials for medicines: apply for authorisation in the UK,https://www.linkedin.com/feed/update/urn:li:activity:7430503953655607297/
2. March 2026,Swissmedic,Forms,Swissmedic Forms for March 2026,
2. March 2026,Swissmedic,Guidance,Performance Studies of IVD,https://www.linkedin.com/feed/update/urn:li:activity:7430501332953956352/
2. March 2026,Therapeutic Goods Administration,Guidance,Complying with the Unique Device Identification requirements for medical devices Guidance for sponsors and manufacturers on complying with Australian UDI requirements,https://www.linkedin.com/feed/update/urn:li:activity:7430506125483175936/
2. March 2026,Therapeutic Goods Administration,Guidance,Manufacturing and supplying surgical loan kits to Australian hospitals,https://www.linkedin.com/feed/update/urn:li:activity:7430508008637468672/







