Date,Agency,Category,Title,Link
'20. July 2026,European Medicines Agency ,Post,European Medicines Agency Expert Decision and Opinion in the Context of the Clinical Evaluation Consultation Procedure (CECP): Dual Chamber Leadless Pacemaker,https://www.linkedin.com/feed/update/urn:li:activity:7484834541170302976/
'20. July 2026,MedTech Leading Voice ,Post,MedTech Leading Voice Continuous MedTech Oversight Comes of Age,https://www.linkedin.com/analytics/group-post-summary/urn:li:activity:7484796908893446144/
'20. July 2026,MedTech Leading Voice ,Post,MedTech Leading Voice Continuous MedTech Oversight Comes of Age,https://www.linkedin.com/feed/update/urn:li:activity:7484796908893446144/
'20. July 2026,Marina Daineko,Post,"Marina Daineko's The MedTech Weekly Digest (Issue 30) Thank you for your time and please Like , Share, and/or Comment",https://www.linkedin.com/feed/update/urn:li:activity:7484872023828168704/
'20. July 2026,Martin King You,Post,Health Canada | Sante Canada Improving Access to Drugs,https://www.linkedin.com/feed/update/urn:li:activity:7484910045479112704/
'20. July 2026,Kaweche Banda,Post,DON'T LET YOUR PHARMACEUTICAL UTILITY SYSTEMS BECOME YOUR NEXT AUDIT FINDING!,https://www.linkedin.com/feed/update/urn:li:activity:7484889653041324032/
'20. July 2026,Marina Daineko,Post,"Go on, it's Monday anyway.",https://www.linkedin.com/feed/update/urn:li:activity:7484866074614710272/
'20. July 2026,Martin King You,Post,"MedTech Leading Voice Regulatory Roundup Monday, 20. July 2026",https://www.linkedin.com/feed/update/urn:li:activity:7484925118171959296/
'20. July 2026,Sara Rosario,Post,and the merger of entities responsible for managing food safety.,https://www.linkedin.com/feed/update/urn:li:activity:7484939268117905408/
