Date,Agency,Category,Title,Link
'26. June 2026,BARBARA PIROLA,Post,"Evolving compliance in chemical-pharmaceutical companies: integrating cybersecurity frameworks into GxP and Quality Management Systems In pharma,",https://www.linkedin.com/feed/update/urn:li:activity:7476316813409251328/
'26. June 2026,Veronique Champagnat,Post,https://lnkd.in/eqVy-3HZ Regulatory risks,https://www.linkedin.com/feed/update/urn:li:activity:7476329595412295680/
'26. June 2026,Stefano Bolletta,Post,OVERVIEW OF MEDICAL DEVICE REIMBURSEMENT SYSTEMS in Central and Eastern Europe (CEE),https://www.linkedin.com/feed/update/urn:li:activity:7476330862956089345/
'27. June 2026,Hadi Danawi,Post,"Happy Friday June 26, 2026. You can follow MENASA Group on LinkedIn: https://lnkd.in/ghuVApBM for the latest daily pharma/clinical trials news updates.",https://www.linkedin.com/feed/update/urn:li:activity:7476387413460938752/
'27. June 2026,Bhaskar Napte ~ Pharma Coach,Post,"Hi everyone, I am excited to meet you tomorrow in the live workshop",https://www.linkedin.com/feed/update/urn:li:activity:7476476775015968768/
'27. June 2026,BARBARA PIROLA,Post,Is FDA redefining how we select first-in-human doses The new,https://www.linkedin.com/feed/update/urn:li:activity:7476495993803497472/
'26. June 2026,Martin King,Post,The highlights of QA/RA Updates 26. June 2026 Quality Assurance & Regulatory Affairs Click on the article to learn more.,https://www.linkedin.com/feed/update/urn:li:activity:7476317874605887488/
