Date,Agency,Category,Title,Link
'23. May 2026,Mosaab GAYA,Post,Most AI health content looks fine on the surface.,https://www.linkedin.com/feed/update/urn:li:activity:7463971844006543360/
'23. May 2026,Martin King,Post,"The highlights of QA/RA Updates 23. May 2026 Quality Assurance & Regulatory Affairs Index Search with direct access the content, try out the Copilot Link now with each entry.",https://www.linkedin.com/feed/update/urn:li:activity:7463974212073054208/
'24. May 2026,Nahid Anjum,Post,"Can a Biosimilar Scenario Reveal, How Smart an AI Tool Really Is?",https://www.linkedin.com/feed/update/urn:li:activity:7464151259516755968/
'24. May 2026,BARBARA PIROLA,Post,PSURs and GVP Module VII: what is EMA really asking from us?,https://www.linkedin.com/feed/update/urn:li:activity:7464183299695902720/
'24. May 2026,Christine Lee,Post,The QA/RA Week that Was 17. - 23. May 2026 Thank you for the 132 entries from 34 contributors.,https://www.linkedin.com/feed/update/urn:li:activity:7464225056404168704/
'24. May 2026,Bhaskar Napte ~ Pharma Coach,Post,Still Waiting for Your First Break in Regulatory Affairs?,https://www.linkedin.com/feed/update/urn:li:activity:7464239751064088576/
'24. May 2026,BARBARA PIROLA,Post,New ICHM11 CeSHarP: are our protocols truly designed for execution Lets be honest: how many protocols look perfect on paper...,https://www.linkedin.com/feed/update/urn:li:activity:7464244780227801088/
'24. May 2026,Martin King,Post,EU Digital & TechL iving guidelines on the responsible use of generative AI in research,https://www.linkedin.com/feed/update/urn:li:activity:7464305672109625344/
'24. May 2026,Martin King,Post,"The highlights of QA/RA Updates 24. May 2026 Quality Assurance & Regulatory Affairs Index Search with direct access the content, try out the Copilot Link now with each entry.",https://www.linkedin.com/feed/update/urn:li:activity:7464356301016543233/
'24. May 2026,Dr C. Sheela Sasikumar Ph D,Post,"In MedTech, innovation may build the product but clinical evidence determines whether the world will trust it......",https://www.linkedin.com/feed/update/urn:li:activity:7464364140833177600/
'24. May 2026,Matthew Wictome,Post,"Having completed my part in a successful transformation at Trinity Biotech as VP Quality and Regulatory Affairs, I am now turning my attention to the next chapter.",https://www.linkedin.com/feed/update/urn:li:activity:7464392003892473857/
'25. May 2026,Sourabh Bansal,Post,INVESTIGATION REPORT FOR CROSS-CONTAMINATION OBSERVED BETWEEN PRODUCTS DURING GRANULATION STAGE,https://www.linkedin.com/feed/update/urn:li:activity:7464494472874074112/
