Date,Agency,Category,Title,Link
'21. April 2026,Manfred Maiers,Post,"In many organizations, PPAP is still viewed as a supplier requirement.",https://www.linkedin.com/feed/update/urn:li:activity:7452386066088689665/
'21. April 2026,Juliana Hechanova,Post,Are your 483 responses ready for the FDAs new expectations?,https://www.linkedin.com/feed/update/urn:li:activity:7452329243990155264/
'22. April 2026,BARBARA PIROLA,Post,The Great USP <1229> Consolidation: Is Your Sterility Assurance Strategy Ready?,https://www.linkedin.com/feed/update/urn:li:activity:7452569745586970624/
'22. April 2026,European Medicines Agency,Post,Clinical Data Publication (CDP) Questions and Answers (Q&As) on EMA Policy 0070 Work-Share Initiative with Health Canada,https://www.linkedin.com/feed/update/urn:li:activity:7452594312497926144/
'22. April 2026,Egyptian Drug Authority,Post,Egyptian Do Not Crush Medication List 2026,https://www.linkedin.com/feed/update/urn:li:activity:7452592816817438721/
'22. April 2026,European Medicines Agency,Post,PMS - Chapter 9: Process for Submitting Existing Data (SIAMED II & XEVMPD to PMS Deltas) - Version 4,https://www.linkedin.com/feed/update/urn:li:activity:7452595499305480192/
'22. April 2026,European Medicines Agency,Post,PMS Electronic Submission of Medicinal Product Information (IDMP) Chapter 3 (Version 3.5),https://www.linkedin.com/feed/update/urn:li:activity:7452594961981685760/
'22. April 2026,South African Health Products Regulatory Authority,Post,SAHPRA Clinical Trials Online Applications Platform,https://www.linkedin.com/feed/update/urn:li:activity:7452597195033411584/
'22. April 2026,Medical Device Authority Malaysia,Post,Full Implementation of Electronic Establishment Licenses Effective 16 April 2026,https://www.linkedin.com/feed/update/urn:li:activity:7452596562783997952/
'22. April 2026,European Commission,Post,Delegated Regulation (EU) 2026/881 on Cybersecurity-Related Grounds for Delaying Notification Dissemination,https://www.linkedin.com/feed/update/urn:li:activity:7452599803105996800/
'22. April 2026,Martin King,Post,FDA Stability Testing for Medicated Premixes (Revision 1) VICH GL8(R) Revision aligns with newer VICH guidance and climatic zone considerations.,https://www.linkedin.com/feed/update/urn:li:activity:7452598273883799552/
'22. April 2026,Galyna Cordero,Post,"Patient-Centric Approach: Key Reasons for Drug Ineffectiveness in Real-World Conditions 1. The ""Non-Ideal Patient"" Phenomenon (Comorbidity)",https://www.linkedin.com/feed/update/urn:li:activity:7452632368596602880/
'22. April 2026,ThetaWave - Regulatory Services,Post,https://lnkd.in/d6qCyrGd,https://www.linkedin.com/feed/update/urn:li:activity:7452642355679256576/
'22. April 2026,Brian Newbery,Post,"Planning for ISO 13485 Implementation, including gap analysis and planning steps for QMS implementation and certification.",https://www.linkedin.com/feed/update/urn:li:activity:7452655347711897600/
'22. April 2026,Galyna Cordero,Post,Lifelong Learning in Pharmacovigilance: Why Stopping Is a Risk to the Patient,https://www.linkedin.com/feed/update/urn:li:activity:7452665390691696640/
'22. April 2026,Rabiea Assoc. Professor,Post,Want a regulatory affairs job?,https://www.linkedin.com/feed/update/urn:li:activity:7452677777184550912/
'22. April 2026,Sreedath Tulamandi,Post,Contact: Sreedath.tulamandi@sgs.com,https://www.linkedin.com/feed/update/urn:li:activity:7452680710173351936/
'22. April 2026,Joby Semmler,Post,Click now to learn about hashtag,https://www.linkedin.com/feed/update/urn:li:activity:7452680718515703810/
'22. April 2026,Keerthi K,Post,Stop letting slow tests and flaky results hold you back!,https://www.linkedin.com/feed/update/urn:li:activity:7452686026420043776/
'22. April 2026,Nataliya Nedkova,Post,You trust your workflow.,https://www.linkedin.com/feed/update/urn:li:activity:7452692122027139074/
'22. April 2026,Hadi Danawi,Post,"Happy Wednesday-April 22, 2026. You can follow MENASA Group on Linkedin: https://lnkd.in/ghuVApBM for the latest daily Pharma/clinical trials news updates.",https://www.linkedin.com/feed/update/urn:li:activity:7452698232759050240/
'22. April 2026,Steve Gompertz,Post,"In this week's Inadequate Response post by QRx Partners, we review a Warning Letter focused on the importance of designing quality into processes rather than relying on inspection and correction.",https://www.linkedin.com/feed/update/urn:li:activity:7452696838186557441/
'22. April 2026,Dr. Paul R. Palmer,Post,https://lnkd.in/eNZhWAyF,https://www.linkedin.com/feed/update/urn:li:activity:7452699488248475648/
'22. April 2026,SWARNAM P,Post,Enroll Now: https://lnkd.in/eewcXPkW ISO 9001:2015 Quality Management System (QMS) The Foundation of Organizational Excellence,https://www.linkedin.com/feed/update/urn:li:activity:7452699504476246016/
'22. April 2026,Mussarat Fatima,Post,"<iframe src=""https://lnkd.in/eHmXkrmd"" height=""566"" width=""504"" frameborder=""0"" allowfullscreen="""" title=""Embedded post""></iframe>",https://www.linkedin.com/feed/update/urn:li:activity:7452723389397659648/
'22. April 2026,Christine Lee,Post,Struggling with ISO audits?,https://www.linkedin.com/feed/update/urn:li:activity:7452728095226118144/
'22. April 2026,MedTech Leading Voice,Post,"Regulatory Roundup Monday, 20. April 2026 Article Edition: Just One Click Away: Try out the Copilot Link with each entry.",https://www.linkedin.com/feed/update/urn:li:activity:7452753586696003585/
'22. April 2026,Angelina Lisandrelli,Post,NEW UPDATE- The EU just updated its Borderline and Classification Manual to Version 4. 6 new case decisions confirm what regulators have been saying for years:,https://www.linkedin.com/feed/update/urn:li:activity:7452755913419010048/
'22. April 2026,Bhaskar Napte ~ Pharma Coach,Post,Online Hands-On eCTD Submission Training: Start Your Career in Regulatory Affairs (RA)!,https://www.linkedin.com/feed/update/urn:li:activity:7452758891471450113/
'22. April 2026,Christine Lee,Post,"The highlights of QA/RA Updates 22. April 2026 Just One Click Away: Index Search with direct access the content, try out the Copilot Link now with each entry.",https://www.linkedin.com/feed/update/urn:li:activity:7452775418929192960/
'22. April 2026,BARBARA PIROLA,Post,Big News in Regulatory Affairs!,https://www.linkedin.com/feed/update/urn:li:activity:7452806786518278145/
'22. April 2026,Martin King,Post,Der Coopers Life Sciences Circle 2026 letzte Woche war ein voller Erfolg.,https://www.linkedin.com/feed/update/urn:li:activity:7452810169039908864/
'22. April 2026,Coopers Group AG,Post,Der Coopers Life Sciences Circle 2026 letzte Woche war ein voller Erfolg.,https://www.linkedin.com/feed/update/urn:li:activity:7452686767549313024/
'22. April 2026,Lilia Soroka,Post,"If cleaning validation is part of your role, this is probably not optional.",https://www.linkedin.com/feed/update/urn:li:activity:7452818855569211392/
'23. April 2026,BARBARA PIROLA,Post,Clinical Data Publication (CDP) Questions and Answers (Q&As) on the European Medicines Agency policy on,https://www.linkedin.com/feed/update/urn:li:activity:7452949546504024064/
