Date,Agency,Category,Title,Link
'29. April 2026,BARBARA PIROLA,Post,Physicochemical and Structural (Q3) Characterization of Topical Drug Products Submitted in ANDAs,https://www.linkedin.com/feed/update/urn:li:activity:7455098517443768320/
'29. April 2026,Sourabh Bansal,Post,"During routine in-process testing at the granulation stage, the moisture content (LOD) of dried granules from FBD was found to be out of specified limits (Observed: 3.5%, Specification: 1.5% 2.5%).",https://www.linkedin.com/feed/update/urn:li:activity:7455136766593851392/
'29. April 2026,Sourabh Bansal,Post,"During routine in-process testing at the granulation stage, the moisture content (LOD) of dried granules from FBD was found to be out of specified limits (Observed: 3.5%, Specification: 1.5% 2.5%).",https://www.linkedin.com/feed/update/urn:li:activity:7455138412304547840/
'29. April 2026,European Medicines Agency,Post,New pilot to support development of breakthrough medical devices,https://www.linkedin.com/feed/update/urn:li:activity:7455155980226633728/
'29. April 2026,European Medicines Agency,Post,Guidance on the details of the classification of variations requiring assessment according to Article 62 of Regulation (EU) 2019/6 for veterinary medicinal products and on the documentation to be submitted pursuant to those variations,https://www.linkedin.com/feed/update/urn:li:activity:7455160886861856768/
'29. April 2026,European Medicines Agency,Post,List of Clinical Evaluation Consultation Procedure (CECP) opinions issued for medical devices awaiting finalisation of conformity assessment,https://www.linkedin.com/feed/update/urn:li:activity:7455166826935889921/
'29. April 2026,USA Food & Drug Administration FDA,Request for Information,FDA AI-Enabled Optimization of Early-Phase Clinical Trials Pilot Program,https://www.linkedin.com/feed/update/urn:li:activity:7455170971243835392/
