Date,Agency,Category,Title,Link
'30. May 2026,Martin King,Post,"The highlights of QA/RA Updates 30. May 2026 Quality Assurance & Regulatory Affairs Index Search with direct access the content, try out the Copilot Link now with each entry.",https://www.linkedin.com/feed/update/urn:li:activity:7466529287177744385/
'30. May 2026,Devin Mack,Post,"After 25+ years in pharmaceutical and medical device quality, I kept seeing the same failure pattern: complaint handling run as a filing exercise, risk files frozen at launch, and FDA and notified-body auditors asking why post-market signals never fed back into the risk evaluation that was supposed to govern them.",https://www.linkedin.com/feed/update/urn:li:activity:7466534397689892864/
'30. May 2026,BARBARA PIROLA,Post,ICH Q8Q9Q10: weve known them for years...,https://www.linkedin.com/feed/update/urn:li:activity:7466557925449363456/
'31. May 2026,Sourabh Bansal,Post,INVESTIGATION REPORT FOR STICKING OF TABLETS TO PUNCHES OBSERVED DURING COMPRESSION STAGE,https://www.linkedin.com/feed/update/urn:li:activity:7466652285499039744/
'31. May 2026,Ahmed Awad,Post,"Docket Insights: A compilation of selected public comments from the carcinogenic Ethylene Oxide (EtO) emissions docket, highlighting specific industry, scientific and public health submissions to US Environmental Protection Agency (EPA).",https://www.linkedin.com/feed/update/urn:li:activity:7466758742940971008/
'31. May 2026,BARBARA PIROLA,Post,"CPV, APR/PQR integration & FDA vs EMA perspective CPV, APR/PQR, QRM: three processes...",https://www.linkedin.com/feed/update/urn:li:activity:7466758267332063232/
'31. May 2026,Bhaskar Napte ~ Pharma Coach,Post,"US Registration & eCTD Submission: IND, NDA, ANDA, BLA",https://www.linkedin.com/feed/update/urn:li:activity:7466773816254550016/
