Date,Agency,Category,Title,Link
'08. May 2026,South African Health Products Regulatory Authority,Communication,Bioequivalence Studies Performed by Contract Research Organisation (Raptim Research Pvt.,https://www.linkedin.com/feed/update/urn:li:activity:7458408763817926657/
'08. May 2026,Swissmedic,Newsletter,Swissmedic Vigilance News Edition 36 (May 2026),https://www.linkedin.com/feed/update/urn:li:activity:7458414037467525120/
'08. May 2026,USA Food & Drug Administration FDA,Announcment,FDA CDRHs Experiential Learning Program (ELP),https://www.linkedin.com/feed/update/urn:li:activity:7458423706474827777/
'08. May 2026,USA Food & Drug Administration FDA,Guidance,Submitting Continuous Glucose Monitoring Data in Clinical Trials,https://www.linkedin.com/feed/update/urn:li:activity:7458389691667734529/
'08. May 2026,"European Directorate for the Quality of Medicines & HealthCare (EDQM), Council of Europe",Guidance,Revision/Renewal of Certificates of Suitability to the European Pharmacopoeia Monographs,https://www.linkedin.com/feed/update/urn:li:activity:7458394781480574976/
'08. May 2026,MedTech Europe,Newsletter,MedTech Europe New EU Rules: More Business Predictability and Transparency in MedTech Conformity Assessment,https://www.linkedin.com/feed/update/urn:li:activity:7458401370287640576/
'08. May 2026,European Commission,Guidance,PMSV Reporting Forms MIR PDF 7.3.1 EC PMSV Reporting page updated 7 May 2026.,https://www.linkedin.com/feed/update/urn:li:activity:7458419926471729152/
'08. May 2026,European Union,Press Release,Artificial Intelligence: Council and Parliament Agree to Simplify and Streamline Rules,https://www.linkedin.com/feed/update/urn:li:activity:7458406745212801024/
'08. May 2026,Keerthi K,Post,"Most teams already know the value of Shift-Left catching bugs early saves time, effort, and release stress.",https://www.linkedin.com/feed/update/urn:li:activity:7458467836567670784/
'08. May 2026,Parameswari C,Post,Enroll Now!,https://www.linkedin.com/feed/update/urn:li:activity:7458476680236482560/
'08. May 2026,Joby Semmler,Post,Click to learn how 21 CFR 11 warning letters trigger FDA hashtag,https://www.linkedin.com/feed/update/urn:li:activity:7458486411223179264/
'08. May 2026,Nahid Anjum,Post,"How CQAs Are Identified, Justified & Linked to Analytical Similarity in Biosimilar Development?",https://www.linkedin.com/feed/update/urn:li:activity:7458502937020059648/
'08. May 2026,BARBARA PIROLA,Post,Strengthening Scientific Advice Through RealWorld Clinical Data: EMAs New Modelling & Simulation Pilot OVERVIEW,https://www.linkedin.com/feed/update/urn:li:activity:7458359460302966784/
'08. May 2026,Bhaskar Napte,Post,eCTD: Your Career Passport to RA CTD authoring opens the door.,https://www.linkedin.com/feed/update/urn:li:activity:7458365236153188352/
'08. May 2026,"European Directorate for the Quality of Medicines & HealthCare (EDQM), Council of Europe",Post,Official Control Authority Batch Release of mRNA Vaccines Produced with LNPs New EDQM/OMCL guideline effective 01 May 2026 establishing harmonised OCABR requirements for mRNA vaccines formulated with LNPs.,https://www.linkedin.com/feed/update/urn:li:activity:7458387096844517376/
'08. May 2026,Pharmaguide Hub,Post,COMPLIANCE REPORT FOR QUALITY MANUAL NOT UPDATED AS PER CURRENT REGULATORY REQUIREMENTS,https://www.linkedin.com/feed/update/urn:li:activity:7458387162892275713/
'08. May 2026,European Medicines Agency,Post,Meeting highlights from the Pharmacovigilance Risk Assessment Committee (PRAC) 4-7 May 2026,https://www.linkedin.com/feed/update/urn:li:activity:7458515910266359809/
'08. May 2026,Steve Gompertz,Post,One of the more common misunderstandings I see in quality systems is treating document revision control as if it is change management.,https://www.linkedin.com/feed/update/urn:li:activity:7458520973575663616/
'08. May 2026,Hadi Danawi,Post,"Happy Friday-May 8, 2026. You can follow MENASA Group on Linkedin: https://lnkd.in/ghuVApBM for the latest daily Pharma/clinical trials news updates.",https://www.linkedin.com/feed/update/urn:li:activity:7458520765953519617/
'08. May 2026,Tasha Mohseni,Post,Your Morning Brew with Tasha Here are some resources and updates I've shared and come across since our last morning brew together:,https://www.linkedin.com/feed/update/urn:li:activity:7458522760332578816/
