Date,Agency,Category,Title,Link
'07. July 2026,Christine Lee,Post,The highlights of QA/RA Updates 7. July 2026 Quality Assurance & Regulatory Affairs Click on the article to learn more.,https://www.linkedin.com/feed/update/urn:li:activity:7480313542508806145/
'07. July 2026,EU Digital & Tech,Post,AI plays a key role in cybersecurity: it has the power to both create and stop cyber threats.,https://www.linkedin.com/feed/update/urn:li:activity:7480342741055586304/
'08. July 2026,European Union Agency for Cybersecurity (ENISA),Post,European Union Agency for Cybersecurity (ENISA)s view on Cybersecurity in the Frontier AI Era This new ENISA position paper (July 2026) sets out recommendations to address cybersecurity risks arising from frontier AI.,https://www.linkedin.com/feed/update/urn:li:activity:7480470726962139138/
'08. July 2026,Martin King,Post,FDA & IQ MPS Training Course,https://www.linkedin.com/feed/update/urn:li:activity:7480470744418816000/
'08. July 2026,Martin King,Post,FDA SOPP 8217: Administrative Processing and Review Management Procedures for Investigational New Drug Applications (Version 7) Version 7 (effective 2 July 2026),https://www.linkedin.com/feed/update/urn:li:activity:7480470758138351616/
